{
  "$schema": "http://json-schema.org/draft-07/schema#",
  "title": "VolumePrescription",
  "type": "object",
  "required": [
    "bodyType", "goal", "sets",
    "repRangeLow", "repRangeHigh",
    "restSeconds", "rpeTarget",
    "intensityPctMin", "intensityPctMax",
    "progressionModel"
  ],
  "properties": {
    "bodyType": {
      "type": "string",
      "enum": ["ECTOMORPH", "MESOMORPH", "ENDOMORPH"]
    },
    "goal": {
      "type": "string",
      "enum": ["STRENGTH", "HYPERTROPHY", "FAT_LOSS"]
    },
    "sets": { "type": "integer", "minimum": 1, "maximum": 8 },
    "repRangeLow": { "type": "integer", "minimum": 1 },
    "repRangeHigh": { "type": "integer", "minimum": 1 },
    "restSeconds": { "type": "integer", "minimum": 20, "maximum": 360 },
    "rpeTarget": { "type": "number", "minimum": 1, "maximum": 10 },
    "intensityPctMin": { "type": "number", "minimum": 0, "maximum": 100 },
    "intensityPctMax": { "type": "number", "minimum": 0, "maximum": 100 },
    "progressionModel": {
      "type": "string",
      "enum": ["LINEAR", "DOUBLE_PROGRESSIVE", "VOLUME_PROGRESSIVE"]
    }
  },
  "additionalProperties": false
}
